SQL> CREATE TABLE PERSON(
  2  PERSON_ID INT PRIMARY KEY,
  3  FNAME VARCHAR(50),
  4  LNAME VARCHAR(50),
  5  CITY VARCHAR(50),
  6  SALARY INT
  7  );

Table created.

SQL> INSERT INTO PERSON VALUES(1, 'SNEHA', 'SHETH', 'RAJKOT', 10000);

1 row created.

SQL> INSERT INTO PERSON VALUES(2, 'PUJA', 'PARMAR', 'AHMEDABAD', 2000);

1 row created.

SQL> INSERT INTO PERSON VALUES(3, 'RIYA', 'GAJAR', 'PUNE', 8000);

1 row created.

SQL> INSERT INTO PERSON VALUES(4, 'SANDIP', 'JADEJA', 'PUNE', 5000);

1 row created.

SQL> INSERT INTO PERSON VALUES(5, 'ALPESH', 'PRAJAPATI', 'MUMBAI', 20000);

1 row created.

SQL> SET LINESIZE 200
SQL> SET PAGESIZE 100
SQL> SET WRAP OFF
SQL> COLUMN PERSON_ID FORMAT A5
SQL> COLUMN FNAME FORMAT A12
SQL> COLUMN LNAME FORMAT A15
SQL> COLUMN CITY FORMAT A12
SQL> COLUMN SALARY FORMAT 9999999999
SQL> SELECT *FROM PERSON;

 PERSON_ID FNAME        LNAME           CITY              SALARY                                                                                                                                        
---------- ------------ --------------- ------------ -----------                                                                                                                                        
########## SNEHA        SHETH           RAJKOT             10000                                                                                                                                        
########## PUJA         PARMAR          AHMEDABAD           2000                                                                                                                                        
########## RIYA         GAJAR           PUNE                8000                                                                                                                                        
########## SANDIP       JADEJA          PUNE                5000                                                                                                                                        
########## ALPESH       PRAJAPATI       MUMBAI             20000                                                                                                                                        

SQL> SELECT PERSON_ID, FNAME FROM PERSON;

 PERSON_ID FNAME                                                                                                                                                                                        
---------- ------------                                                                                                                                                                                 
########## SNEHA                                                                                                                                                                                        
########## PUJA                                                                                                                                                                                         
########## RIYA                                                                                                                                                                                         
########## SANDIP                                                                                                                                                                                       
########## ALPESH                                                                                                                                                                                       

SQL> SELECT * FROM PERSON ORDER BY SALARY;

 PERSON_ID FNAME        LNAME           CITY              SALARY                                                                                                                                        
---------- ------------ --------------- ------------ -----------                                                                                                                                        
########## PUJA         PARMAR          AHMEDABAD           2000                                                                                                                                        
########## SANDIP       JADEJA          PUNE                5000                                                                                                                                        
########## RIYA         GAJAR           PUNE                8000                                                                                                                                        
########## SNEHA        SHETH           RAJKOT             10000                                                                                                                                        
########## ALPESH       PRAJAPATI       MUMBAI             20000                                                                                                                                        

SQL> SELECT DISTINCT CITY FROM PERSON;

CITY                                                                                                                                                                                                    
------------                                                                                                                                                                                            
RAJKOT                                                                                                                                                                                                  
MUMBAI                                                                                                                                                                                                  
AHMEDABAD                                                                                                                                                                                               
PUNE                                                                                                                                                                                                  

SQL> SELECT * FROM PERSON WHERE LNAME='PRAJAPATI';

 PERSON_ID FNAME        LNAME           CITY              SALARY                                                                                                                                        
---------- ------------ --------------- ------------ -----------                                                                                                                                        
########## ALPESH       PRAJAPATI       MUMBAI             20000                                                                                                                                        

SQL> ALTER TABLE PERSON ADD (STATE VARCHAR(50), BIRTHDATE DATE, PINCODE INT);

Table altered.

SQL> COMMIT;

Commit complete.

SQL> SELECT * FROM PERSON WHERE SALARY > 6000;

 PERSON_ID FNAME        LNAME           CITY              SALARY STATE                                              BIRTHDATE    PINCODE                                                                
---------- ------------ --------------- ------------ ----------- -------------------------------------------------- --------- ----------                                                                
########## SNEHA        SHETH           RAJKOT             10000                                                                                                                                        
########## RIYA         GAJAR           PUNE                8000                                                                                                                                        
########## ALPESH       PRAJAPATI       MUMBAI             20000                                                                                                                                        

SQL> DELETE FROM PERSON WHERE SALARY < 3000;

1 row deleted.

SQL> COMMIT;

Commit complete.

SQL> RENAME PERSON TO PERSON_MASTER;

Table renamed.
 
SQL> SELECT * FROM PERSON_MASTER;

 PERSON_ID FNAME        LNAME           CITY              SALARY STATE                                              BIRTHDATE    PINCODE                                                                
---------- ------------ --------------- ------------ ----------- -------------------------------------------------- --------- ----------                                                                
########## SNEHA        SHETH           RAJKOT             10000                                                                                                                                        
########## RIYA         GAJAR           PUNE                8000                                                                                                                                        
########## SANDIP       JADEJA          PUNE                5000                                                                                                                                        
########## ALPESH       PRAJAPATI       MUMBAI             20000                                                                                                                                        

SQL> SPOOL OFF;
