SQL> CREATE TABLE ITEM_MASTER (
  2      ID VARCHAR2(5),
  3      NAME VARCHAR2(20),
  4      TYPE VARCHAR2(20),
  5      PRICE NUMBER(10),
  6      QUALITY VARCHAR2(15),
  7      ITEM_PACK_DATE DATE
  8  );

Table created.

SQL> INSERT INTO ITEM_MASTER VALUES ('I1','DAIRYMILK','CHOCOLATE',500,'GOOD',TO_DATE('12-AUG-2000','DD-MON-YYYY'));

1 row created.

SQL> 
SQL> INSERT INTO ITEM_MASTER VALUES ('I2','KAJUKATRI','MITHAI',1000,'VERYGOOD',TO_DATE('15-JAN-2016','DD-MON-YYYY'));

1 row created.

SQL> 
SQL> INSERT INTO ITEM_MASTER VALUES ('I3','PIZZA','FASTFOOD',350,'AVERAGE',TO_DATE('20-FEB-2015','DD-MON-YYYY'));

1 row created.

SQL> 
SQL> INSERT INTO ITEM_MASTER VALUES ('I4','ORANGEJUICE','JUICE',50,'BEST',TO_DATE('05-FEB-2016','DD-MON-YYYY'));

1 row created.

SQL> 
SQL> INSERT INTO ITEM_MASTER VALUES ('I5','VANILLA_CAKE','BAKERY',2000,'GOOD',TO_DATE('01-JAN-2016','DD-MON-YYYY'));

1 row created.

SQL> SELECT PRICE, QUALITY, ITEM_PACK_DATE
  2  FROM ITEM_MASTER;

     PRICE QUALITY         ITEM_PACK                                            
---------- --------------- ---------                                            
       500 GOOD            12-AUG-00                                            
      1000 VERYGOOD        15-JAN-16                                            
       350 AVERAGE         20-FEB-15                                            
        50 BEST            05-FEB-16                                            
      2000 GOOD            01-JAN-16                                          

SQL> SET LINESIZE 200
SQL> SET PAGESIZE 100
SQL> SET WRAP OFF
SQL> COLUMN ID FORMAT A5
SQL> COLUMN NAME FORMAT A12
SQL> COLUMN TYPE FORMAT A12
SQL> COLUMN PRICE FORMAT 999999
SQL> COLUMN QUALITY FORMAT A20
SQL> COLUMN ITEM_PACK_DATE FORMAT A20
SQL> SELECT * FROM ITEM_MASTER;

ID    NAME         TYPE           PRICE QUALITY              ITEM_PACK_DATE                                                                                                                             
----- ------------ ------------ ------- -------------------- --------------------                                                                                                                       
I1    DAIRYMILK    CHOCOLATE        500 GOOD                 12-AUG-00                                                                                                                                  
I2    KAJUKATRI    MITHAI          1000 VERYGOOD             15-JAN-16                                                                                                                                  
I3    PIZZA        FASTFOOD         350 AVERAGE              20-FEB-15                                                                                                                                  
I4    ORANGEJUICE  JUICE             50 BEST                 05-FEB-16                                                                                                                                  
I5    VANILLA_CAKE BAKERY          2000 GOOD                 01-JAN-16                                                                                                                                  

SQL> SELECT * FROM ITEM_MASTER
  2  ORDER BY QUALITY;

ID    NAME         TYPE           PRICE QUALITY              ITEM_PACK_DATE                                                                                                                             
----- ------------ ------------ ------- -------------------- --------------------                                                                                                                       
I3    PIZZA        FASTFOOD         350 AVERAGE              20-FEB-15                                                                                                                                  
I4    ORANGEJUICE  JUICE             50 BEST                 05-FEB-16                                                                                                                                  
I5    VANILLA_CAKE BAKERY          2000 GOOD                 01-JAN-16                                                                                                                                  
I1    DAIRYMILK    CHOCOLATE        500 GOOD                 12-AUG-00                                                                                                                                  
I2    KAJUKATRI    MITHAI          1000 VERYGOOD             15-JAN-16                                                                                                                                  

SQL> SELECT DISTINCT QUALITY
  2  FROM ITEM_MASTER;

QUALITY                                                                                                                                                                                                 
--------------------                                                                                                                                                                                    
GOOD                                                                                                                                                                                                    
VERYGOOD                                                                                                                                                                                                
AVERAGE                                                                                                                                                                                                 
BEST                                                                                                                                                                                                    

SQL> UPDATE ITEM_MASTER
  2  SET QUALITY = 'VERYGOOD'
  3  WHERE QUALITY = 'GOOD';

2 rows updated.

SQL> COMMIT;

Commit complete.

SQL> SELECT * FROM ITEM_MASTER
  2  WHERE QUALITY = 'VERYGOOD';

ID    NAME         TYPE           PRICE QUALITY              ITEM_PACK_DATE                                                                                                                             
----- ------------ ------------ ------- -------------------- --------------------                                                                                                                       
I1    DAIRYMILK    CHOCOLATE        500 VERYGOOD             12-AUG-00                                                                                                                                  
I2    KAJUKATRI    MITHAI          1000 VERYGOOD             15-JAN-16                                                                                                                                  
I5    VANILLA_CAKE BAKERY          2000 VERYGOOD             01-JAN-16                                                                                                                                  

SQL> ALTER TABLE ITEM_MASTER
  2  ADD ITEM_PUR_DATE DATE;

Table altered.

SQL> COMMIT;

Commit complete.

SQL> SELECT * FROM ITEM_MASTER
  2  WHERE PRICE > 500;

ID    NAME         TYPE           PRICE QUALITY              ITEM_PACK_DATE       ITEM_PUR_                                                                                                             
----- ------------ ------------ ------- -------------------- -------------------- ---------                                                                                                             
I2    KAJUKATRI    MITHAI          1000 VERYGOOD             15-JAN-16                                                                                                                                  
I5    VANILLA_CAKE BAKERY          2000 VERYGOOD             01-JAN-16                                                                                                                                  

SQL> DELETE FROM ITEM_MASTER
  2  WHERE PRICE = 50;

1 row deleted.

SQL> COMMIT;

Commit complete.

SQL> RENAME ITEM_MASTER TO ITEM_DETAIL;

Table renamed.

SQL> SPOOL OFF;
